{
  "scar_id": "scar_012",
  "created_at": "2026-09-12T16:00:00Z",
  "label": "example stub scar (PLACEHOLDER metrics)",
  "placeholder": true,
  "metrics": {
    "volume_mm3": 1000.0,
    "vias": 10,
    "copper_layers": 4
  },
  "score": 21500.0,
  "gates": {
    "drc_clean": false,
    "erc_clean": false,
    "netlist_match": false,
    "fab_stackup_ok": true,
    "min_trace_clearance": false,
    "via_annular_ok": false,
    "outline_closed": true
  },
  "gates_ok": false,
  "weave": {
    "project": "copper-scar",
    "run_id": "example-run",
    "span_ids": ["span_plan", "span_place", "span_route", "span_score"]
  },
  "tools_used": [],
  "notes": "Illustrative scar for schema + CLI demos. Not a fab-verified board."
}
